<?xml version="1.0" encoding="UTF-8"?>
<PurchaseOrder xmlns:xsi="http://www.w3.org/2001/XMLSchema-instance" xsi:noNamespaceSchemaLocation="file:///C:/Users/Admin/Documents/service-oriented-computing-lab/lab01/PurchaseOrder/PurchaseOrder.xsd">
	<Item>
		<Name>Laptop</Name>
		<Price>2000</Price>
		<Quantity>20</Quantity>
	</Item>
	<Item>
		<Name>Laptop</Name>
		<Price>200</Price>
		<Quantity>10</Quantity>
	</Item>
	<Item>
		<Name>Printer</Name>
		<Price>2000</Price>
		<Quantity>15</Quantity>
	</Item>
	<ShippingAddress>
		<Street>10 main road</Street>
		<City>Dubai</City>
		<Pin>333-4444</Pin>
	</ShippingAddress>
</PurchaseOrder>
